{
  "id": "safe-vs-priced",
  "title": "SAFE ($18M Cap) vs Priced Series A ($20M Pre)?",
  "titlePt": "SAFE ($18M Cap) vs Rodada S횄짤rie A Precificada ($20M Pr횄짤)?",
  "category": "financial",
  "categoryLabel": "Financial Decision",
  "categoryLabelPt": "Decis횄짙o Financeira",
  "createdDays": 5,
  "value": "Capital raise: $2.5M",
  "valuePt": "Capta횄짠횄짙o de capital: $2.5M",
  "aiConfidence": 76,
  "confidenceLevel": "high",
  "personalModelAlert": {
    "en": "Your 'Transparent Communication' core value strongly favors priced round despite SAFE's speed/simplicity advantages. AI analysis weighs structural transparency against founder convenience.",
    "pt": "Seu valor fundamental de 'Comunica횄짠횄짙o Transparente' favorece fortemente a rodada precificada, apesar das vantagens de velocidade/simplicidade do SAFE. A an횄징lise da IA pondera transpar횄짧ncia estrutural contra conveni횄짧ncia do fundador."
  },
  "alternatives": [
    {
      "id": "safe-18m",
      "name": "SAFE at $18M Cap",
      "namePt": "SAFE com Cap de $18M",
      "score": 6.8,
      "recommended": false,
      "advantages": [
        {"en": "Fast close (2-3 weeks)", "pt": "Fechamento r횄징pido (2-3 semanas)"},
        {"en": "Lower legal costs ($15K)", "pt": "Custos legais menores ($15K)"},
        {"en": "Flexibility on valuation", "pt": "Flexibilidade na avalia횄짠횄짙o"},
        {"en": "No board seat until conversion", "pt": "Sem cadeira no conselho at횄짤 convers횄짙o"}
      ],
      "risks": [
        {"en": "Valuation uncertainty (13.9%-20.8%)", "pt": "Incerteza de avalia횄짠횄짙o (13.9%-20.8%)"},
        {"en": "Conflicts with 'Transparent Communication' value", "pt": "Conflita com valor 'Comunica횄짠횄짙o Transparente'"},
        {"en": "Cannot communicate clear ownership to team", "pt": "N횄짙o pode comunicar ownership claro para equipe"},
        {"en": "Defers governance discussion", "pt": "Adia discuss횄짙o de governan횄짠a"}
      ]
    },
    {
      "id": "priced-20m",
      "name": "Priced Round at $20M Pre",
      "namePt": "Rodada Precificada a $20M Pr횄짤",
      "score": 8.2,
      "recommended": true,
      "advantages": [
        {"en": "Clear cap table (11.1% dilution)", "pt": "Cap table claro (11.1% dilui횄짠횄짙o)"},
        {"en": "Aligns with 'Transparent Communication'", "pt": "Alinha com 'Comunica횄짠횄짙o Transparente'"},
        {"en": "Market validation signal", "pt": "Sinal de valida횄짠횄짙o de mercado"},
        {"en": "Cleaner Series B setup", "pt": "Setup mais limpo para S횄짤rie B"},
        {"en": "Board experience now", "pt": "Experi횄짧ncia de conselho agora"}
      ],
      "risks": [
        {"en": "Slower close (6-8 weeks)", "pt": "Fechamento mais lento (6-8 semanas)"},
        {"en": "Higher legal costs ($40-50K)", "pt": "Custos legais maiores ($40-50K)"},
        {"en": "Valuation becomes public anchor", "pt": "Avalia횄짠횄짙o se torna 횄짖ncora p횄쨘blica"},
        {"en": "More extensive governance", "pt": "Governan횄짠a mais extensa"}
      ]
    }
  ],
  "recommendation": {
    "title": "Priced Round at $20M Pre",
    "titlePt": "Rodada Precificada a $20M Pr횄짤",
    "summary": {
      "en": "Given your 'Transparent Communication' core value and moderate-high financial risk tolerance, AI recommends priced Series A. The $20M pre valuation is fair (3.3x ARR at $600K current), and structural transparency enables clearer team communication and Series B preparation.",
      "pt": "Dado seu valor fundamental de 'Comunica횄짠횄짙o Transparente' e toler횄짖ncia a risco financeiro moderada-alta, a IA recomenda S횄짤rie A precificada. A avalia횄짠횄짙o pr횄짤 de $20M 횄짤 justa (3.3x ARR a $600K atual), e transpar횄짧ncia estrutural permite comunica횄짠횄짙o mais clara com equipe e prepara횄짠횄짙o para S횄짤rie B."
    }
  }
}
